Id,shopname,shopsite,abstract,shoptype,score_all,qualification,foundtime,addr,tel,contactinfo,opentime
52,居丽装潢(蒲汇塘路店),,一家建筑、建材的企业，是经国家相关部门批准注册的企业，主营装潢业务,装修,B,设计与施工一级,,蒲汇塘路200号申航大厦5楼(近宜山路),021-64682287,,
364,居丽装潢(浦建路店),,一家建筑、建材的企业，是经国家相关部门批准注册的企业，主营装潢业务,装修,B,设计与施工一级,,浦建路338号208-213室(近东方路),021-58395688,,9：00-18：00
344,居丽装潢(浦三路店),,一家建筑、建材的企业，是经国家相关部门批准注册的企业，主营装潢业务,装修,B,设计与施工一级,,浦三路518号三斯商务楼A座312室(近临沂路),021-50893061&nbsp;50895529,,
54,居室堂装饰,http://www.jstzs.com/cloud.asp,秉承一家一设计理念的装修公司,装修,B,,,凯旋路3011号4楼D003-D015室(轻轨3号线宜山路站),64410759-801,,
673,居顺装潢,,国家二级资质的装潢公司，具有与时俱进的创新意识,装修,B,国家二级资质,,梅川路1518号祥和大厦内(近万镇路),021-52785951,,948、837、740、947、950、860、717、827、北安线、陆安线、北安区间、876
791,居顺装潢(沪太路店),,国家二级资质的装潢公司，具有与时俱进的创新意识,装修,B,国家二级资质,,沪太路1198号,,,
868,居云室内装潢(控江路店),,上海市建筑装饰会员，装饰装修行业协会单位，家庭装潢国家二级资质证书,装修,B,设计与施工二级,1997,控江路1023号好饰家3楼E19(近黄兴路),021-65731229&nbsp;65701083,,"6,220,870,90，大桥四线，地铁8号线"
333,居云室内装潢(蓝村大厦店),,上海市建筑装饰会员，装饰装修行业协会单位，家庭装潢国家二级资质证书,装修,B,设计与施工二级,1997,蓝村路1381号蓝村大厦16楼A-B室(近东方路),021-58602878,,8:00-18:00
579,居云装潢(东方路店),,上海市建筑装饰会员，装饰装修行业协会单位，家庭装潢国家二级资质证书,装修,B,设计与施工二级,1997,东方路1381号,,,
173,矩顺建筑装饰,http://www.jushun.net/,专业从事房屋搭建、装修、设计和改建工程,装修,B,,,天钥桥路69弄3号908室,021-63580353,,9:00-18:00（全年无休）
698,聚创装潢,,专业从事于中高档的公寓、别墅、办公空间、商业空间等室内外的装饰设计与施工,装修,B,,2005,曹杨路540号中联大厦1101室(近中山北路),021-61533058,,44、136、62、923、737、3、4、11号线
915,聚鹏设计,http://www.shjupeng.cn,"承“以人为本,设计让生活更美好!”的理念，致力为客户提供高水准的室内设计",装修,B,,2005,邯郸路58弄2号102室,021-65168592,,
872,聚唐装饰(大连路店),http://www.jutangzh.cn/gsjs.asp,从事室内外装饰设计和施工的专业化公司，有着十多年在国内外装饰市场的设计及施工经验，二级资质水平，系中国建筑装饰协会会员单位,装修,B,设计与施工二级,,大连路541号(近双阳路),021-65415027,,9:00--18:00
649,军浩装饰,http://www.ejunhao.com/,上海市装饰装修行业协会会员单位， 并具备装饰专业资质，是一家集家装、公装、室内装饰设计、家居豪宅、别墅空间、于一体的多元化企业，军人团队,装修,B,设计与施工专业级资质,,曹安路1775弄兆地商务金座B座739室(近东方汽配城),021-60547396,,7*24
254,君邑装潢设计,,一家专业做室内装饰设计和施工的企业,装修,B,,,延安西路1118号长峰大厦2408室(近番愚路),021-52383830&nbsp;52385696,,10:00 – 20:00
298,恺天装饰设计,http://www.skycreation.com.cn,国际ISO9001、国际ISO14001及国际OHSAS18001认证企业,装修,B,,2008,南京西路1486号3楼1108室(近静安寺),021-62473281,,10.00-18.00
146,匡氏装潢,http://www.ksjzzh.com/,上海市装饰装修行业协会单位、上海装饰装修三级资质、绿色环保定点检测单位、2006－2008年零投诉单位、重合同、守信用单位。主营“公共建筑空间设计、施工”,装修,B,上海装饰装修三级资质,,桂平路264号,,,93 257
684,阔祥装饰设计,http://www.shkuoxiang.com/,“上海市室内装饰协会会员单位”、“中国质量万里行企业单位”、上海绿色环保定点单位“之一。专业从事住宅，大型公用建筑及家居装饰设计、工程施工、材料配送、家装饰品开发为一体的全方位企业,装修,B,,,中山北路3856号中环大厦2号楼23楼25室(华师大对面),021-52110369&nbsp;13916319658,,09，00—17，00
207,拉舍尔居家设计方案专家,http://sh.tobosu.com/member/37779,上海闸北建筑装饰工程有限公司旗下优质的设计品牌，专业从事别墅、平层，集设计、施工、装饰、软装配饰、空间智能等相关配套为一体的高端设计品牌,设计,B,,2012,宜山路290号102幢(近时尚建材广场),021-61727877,,
794,莱诚装潢,http://www.lczhgs.com/,二级资质,装修,B,设计与施工二级,1997,汶水路40-6号莱诚商务楼内,021-66315477,,
786,兰君室内装潢,http://www.ljzh.cn/,上海兰君室内装潢有限公司前身是上海强生装潢公司，具有法人资格的室内装饰装潢工程企业。原强生公司为上海市家庭装饰行业协会创始会员，是历届协会常务理事单位。现公司已重新注册加入协会，会员号为T0931上海市信得过家庭装饰企业；上海市家庭装饰装修行业规范服务达标企业；上海市家庭装饰装修二星级企业。上海市信得过家庭装饰企业；上海市家庭装饰装修行业规范服务达标企业；上海市家庭装饰装修二星级企业。,装修,B,,,闸北区彭浦新村岭南路711号（保德路口），公司斜对面即46路岭南路终点站。,021-66836934；021-56811024,"免费咨询电话   4006608776
QQ在线洽谈    335218455        317683987        1443591010",8：00-17：00
200,蓝月装饰,http://www.shlanyue.com/,是一家从事建筑室内装饰设计及施工的专业化公司。拥有超强的设计团队以及组织施工能力，旗下拥有数百名员工。在建工地遍布整个上海及周边城市，其中包括精品别墅，复式，商品房以及商业空间等等。,装修,B,,2004年,宜山路439号七建大厦17楼,021-62676666,,
416,乐平装修装饰(成山路店),http://www.shleping.cn/,本公司配备了具有上海市装饰装修行业协会注册的建筑室内设计师数名。运用先进的理念，专业美学修养，独到的审美观，来充分体现客户的个性要求与生活实用性。,装修,B,专业级,1999,成山路2122号(成山路下南路),021-50935971,,9:00--18:00
8,乐益城市空间设计(凯旋路店),http://www.shleyi.cn,国家建筑装饰二级资质企业,装修,B,装饰二级,2003,凯旋路2701-4号2-3楼,021-64391378,电话:021-64391378,9：00~19:00
326,乐益城市空间设计(周浦万达店),http://www.shleyi.cn,国家建筑装饰二级资质企业,装修,B,装饰二级,2003,年家浜路528弄万达广场B栋1101室(近沪南公路),021-20903857,电话:021-20903857,9：00~19:00
880,林权创意设计,, 打造旧房改造装修第一品牌，我们公司致力于为每一位客户答疑解惑，急客户之所急，打造舒适的空间，提供专业的服务，不懈努力以提升和超越客户的消费价值。,装修,B,,,铁岭路32号同叶大厦809室(近锦西路),021-65130455&nbsp;36500321,,8：30-18：00
340,凌君装饰设计,http://zhengma.qy01.com/main.asp,多年从事装饰装修行业，公司涉及建筑装潢，建筑装潢设计，别墅装潢，别墅装潢设计，室内装潢，室内装潢设计，土木工程施工，园林绿化，办公智能化设备安装，装潢材料,装修,B,,2004年,东方路1359弄海富花园2号楼11E室(近蓝村路地铁站),4000172017&nbsp;50473396,,09:30--17:30
306,菱海建筑装潢,http://www.linghai-zs.com/,原系上海市经委下属企业，后转制为中加合作的民营股份制企业。公司长期从事室内设计装潢，专精各类餐厅、酒店、商铺、会所和办公等空间的设计和施工。擅长别墅、复式、公寓等豪宅的设计装潢。,装修,B,,1996年,余姚路99号-1(近海防路),021-62585919&nbsp;4007790566,,09:00-18:00
602,龙发装饰(陆家浜路店),http://www.longfa-sh.com/,现为中国建筑装饰协会副会长会员单位，是全国首批建筑行业信用评价AAA级，设计甲级、施工壹级企业，服务网络遍布全国，并于2003年始开拓国际市场，成为业内第一家拓展海外业务的装饰企业。,装修,B,设计甲级施工一级,1997年,陆家浜路698号,4008086655,,9:00-21:00
93,龙目装饰,http://www.shlmzs.com/,"是一家致力于居家、办公室、厂房、商业空间等室内外设计与施工为一体的实力型装饰企业。上海市首批会员单位之一，拥有各种荣誉奖项及资质，拥有各种优秀监理，设计师及施工人员，十年以上的优秀施工人员。多年来在广大客户及同行中赢得了优秀的管理特色好评。
",装修,B,,2004,宜山路520号中华门大厦1704室(近中山西路),021-64579009,,8：00---19：00
378,茂华装潢(芳芯路店),,是一家集设计与施工为一体的专业化装潢企业。,装修,B,,2003,芳芯路325号(近龙阳路地铁站),021-50425523,,公交794、975、地铁7号线、2号线等
859,美力达装饰,http://www.51mld.net/,为客户提供装修方案设计、施工、软装方案设计、软装配套等多项服务,装修,B,,1999年,黄兴路1417号(近延吉西路),021-65143554,,早上9：30——下午18：00
878,美凌装饰,http://idkin.com/300658878/home/,上海市装饰装修行业协会理事长单位、上海市装饰装修行业协会家装委常务理事长单位。,装修,B,,2002年,控江路1029弄1号14楼1409-1410室,021-59714971,,
432,美旗装潢(东方路店),http://meiqi.ypb.cn/,国家建筑装修装饰工程专业承包二级资质 建筑装饰工程设计乙级资质 ,装修,B,,1997年,东方路906号(近潍坊路),021-50581607,,
654,米申空间,,米申装米申装饰设计特色：小户型：充分利用空间，实用性强；公寓房：设计感强，兼具美观与实用；别墅：彰显个人品位，定制个性化的家装方案。 ,装修,B,,,真北路988号2号327室(近金沙谷创意园区),021-60127612,,
404,面对面装潢,http://www.10713.zxdyw.com/gsjj.aspx?MID=10713,"上海面对面装潢服务有限公司，是一家以私人会所、豪宅、别墅、精品公寓空间设计个性定制装修以及商业空间设计装修为主营业务的公司。是未来智能家居体验装修发起企业之一，汇聚众多国际资深设计精英，是一家专门从事室内外装潢设计的企业。
经营范围：新居.婚房.中高档住宅.酒店式公寓,别墅装修,办公室写字楼,多媒体网络系统等等。
 在多年的装潢实践中，建立了一支高水平的管理、设计和施工队伍，在装潢方面积累了丰富的经验。形成了业务承接、装潢设计、现场施工、项目管理、竣工验收、售后服务等一系列的规范管理。",装修,B,,,东方路1365号19楼E座(近蓝村路地铁站),021-50159709,,9：00 -   18:00
597,世班空间设计,http://www.shiban99.com/, 上海世班建筑装饰工程设计有限公司（简称：上海世班空间设计）是一家集装修设计、工程施工为一体的一站式服务企业。我们始终坚持将环保装修坚持到底，并严格执行ISO9001和ISO14001标准。我们的服务涉及办公空间、商业空间的室内外装饰设计及工程施工管理，工程项目涉及社会多个领域，包括办公写字楼、会所、展厅、美容SPA馆、专卖店铺、酒店餐厅及咖啡馆的设计与装饰。,装修/设计,B,,,上海市闵行区浦锦路38号万科VMO广场38号楼220室,021-53083836,,9:00-17:00
917,所翡雅装潢,http://www.sfyzh.com/,上海所翡雅装饰有限公司，是一家集装饰设计、工程施工、材料配送一体化的装饰企业，专业从事家居、别墅、写字楼、商铺、酒店的设计与施工，所翡雅，英文名为sophia，我们的目标就如我们的名字一样，让您的住所犹如翡翠般美丽优雅。,装修/设计,B,,,辽源东路7号(近源泉路),021-65391524,,am:7:00~pm:22:00
740,所翡雅装饰,http://www.sfyzh.com/,上海所翡雅装饰有限公司，是一家集装饰设计、工程施工、材料配送一体化的装饰企业，专业从事家居、别墅、写字楼、商铺、酒店的设计与施工，所翡雅，英文名为sophia，我们的目标就如我们的名字一样，让您的住所犹如翡翠般美丽优雅。,装修/设计,B,,,石泉路338号(近武宁路),13370080126,,
69,索凡建筑装饰设计,http://www.sf-021.com/,上海索凡装璜设计有限公司位于上海徐汇区中山西路，是经建设部门批准的正规装饰企业，市装饰协会会员单位，上海消费者最信赖的家装品牌，市守合同重信用企业。,装修/设计,B,,,中山西路2025号永升大厦526室(近宜山路),021-60319689&nbsp;60319659,,9：00-20：00
256,唐居装饰设计,http://www.tangju.com/news.asp?typeid=2,唐居，全名上海唐居室内设计装饰有限公司专业从事家装、工装国内一流设计、施工一体化装修公司，为客户全方位、从外至内地定制符合项目和环境的专业、完美的整体解决方案。,装修/设计,B,,,上海市普陀区曹杨路540号中联大厦29楼,021-64481467&nbsp;64461457,,早上9点30分-下午5点30分
455,腾阁装饰,http://www.attico.com.cn/,上海腾阁坚持以精致施工为主，以追求效率与效益的工程管理为目标，以包退包换包修的服务理念，赢得了许多知名专业设计工作室的青睐，成为施工工程长期配合的伙伴。 ,装修/设计,B,,,东方路1359号2号楼21c,15921085757,,
732,腾龙设计(北方设计中心),http://www.jttl111.com/,腾龙设计隶属于上海名牌装饰企业聚通集团旗下的高端设计服务品牌。聚通集团成立于1994年，拥有国家建设部颁发的建筑装饰装修工程设计、施工双一级资质。是上海首家推出品牌化服务和连锁型经营模式的装饰企业。因此，聚通也被业界冠以 “沪上装潢龙头企业”的美誉。,装修/设计,B,,1994,金沙江路1628弄10号18楼,021-31210073&nbsp;31210074,,9:00-17:00
82,腾龙设计(徐汇设计中心),http://www.jttl111.com/,腾龙设计隶属于上海名牌装饰企业聚通集团旗下的高端设计服务品牌。聚通集团成立于1994年，拥有国家建设部颁发的建筑装饰装修工程设计、施工双一级资质。是上海首家推出品牌化服务和连锁型经营模式的装饰企业。因此，聚通也被业界冠以 “沪上装潢龙头企业”的美誉。,装修/设计,B,,1994,天钥桥路93号中福实业大厦12楼,021-64046288&nbsp;64046251,,9:00-17:00
874,同济居家装饰(荣广商务店),http://www.tongji365.com.cn/,上海同济居家装饰是根据同济大学创办“一流大学 发展 “产 学 研”三位一体，建立一支“综合性，集团性，高科技”校办企业大军的发展战略，于1995年1月经工商注册设立的校办企业。同济大学产业唯一家装服务企业。 ,,B,,1995,昆明路572号荣广商务中心(近荆州路),021-51534716,,4号线大连路站  870  871  
884,同济居家装饰(延吉中路店),http://www.tongji365.com.cn/,上海同济居家装饰是根据同济大学创办“一流大学 发展 “产 学 研”三位一体，建立一支“综合性，集团性，高科技”校办企业大军的发展战略，于1995年1月经工商注册设立的校办企业。同济大学产业唯一家装服务企业。 ,,B,,1995,延吉中路126号(近苍州路),021-65730385,,"周一,周二,周三,周四,周五,周六 09:00 - 18:00"
869,同济装潢(大连路店),http://www.tongjicn.com,上海同济建筑装潢有限公司，是一家拥有建筑装潢装饰工程施工一级资质、机电设备安装工程施工三级资质的优秀知名企业，注册资金为2500万人民币，依托于同济大学土木建筑装潢专业的优势，拥有一支技术上成熟、专业上完备的设计和施工力量，并已经在装潢行业以及高档办公室装潢行业建立了自己的声誉。,装修/设计,B,,,大连路950号海上商务楼8号楼3楼(大连路飞虹路),021-33770705,,
860,同济装潢(国康路店),http://www.tongji365.com.cn/,上海同济建筑装潢有限公司，是一家拥有建筑装潢装饰工程施工一级资质、机电设备安装工程施工三级资质的优秀知名企业，注册资金为2500万人民币，依托于同济大学土木建筑装潢专业的优势，拥有一支技术上成熟、专业上完备的设计和施工力量，并已经在装潢行业以及高档办公室装潢行业建立了自己的声誉。,装修/设计,B,,,国康路46号同济科技大厦5楼(近同济大学),021-62605198,,9:00-18:00
471,同济装潢(康桥路店),http://www.tongjicn.com,上海同济建筑装潢有限公司，是一家拥有建筑装潢装饰工程施工一级资质、机电设备安装工程施工三级资质的优秀知名企业，注册资金为2500万人民币，依托于同济大学土木建筑装潢专业的优势，拥有一支技术上成熟、专业上完备的设计和施工力量，并已经在装潢行业以及高档办公室装潢行业建立了自己的声誉。,装修/设计,B,,,康桥路787号中天商务科技园3号楼234室(近锦绣路),021-50596594,,9:00-18:00
65,同济装潢(零陵路店),http://www.tongjicn.com,上海同济建筑装潢有限公司，是一家拥有建筑装潢装饰工程施工一级资质、机电设备安装工程施工三级资质的优秀知名企业，注册资金为2500万人民币，依托于同济大学土木建筑装潢专业的优势，拥有一支技术上成熟、专业上完备的设计和施工力量，并已经在装潢行业以及高档办公室装潢行业建立了自己的声誉。,装修/设计,B,,,零陵路899号飞洲国际大厦20楼J座(近漕溪北路),021-65025907,,10:00 – 22:00
411,同济装潢(上南路店),http://www.tongjicn.com,上海同济建筑装潢有限公司，是一家拥有建筑装潢装饰工程施工一级资质、机电设备安装工程施工三级资质的优秀知名企业，注册资金为2500万人民币，依托于同济大学土木建筑装潢专业的优势，拥有一支技术上成熟、专业上完备的设计和施工力量，并已经在装潢行业以及高档办公室装潢行业建立了自己的声誉。,装修/设计,B,,,上南路3062号(近德州路),021-58327083,,9：00----5：30
712,图盛装饰,http://www.sh-tuson.com/,上海图盛建筑装饰工程有限公司是一家专业从事办公空间、商业空间、展示空间、居住空间装饰设计与施工一体化的建 筑企业，致力于为国内外各类企事业单位及商家提供装饰工程一站式解决方案。公司下设工程部、设计部、材料部、质量安全管理部、材料配送中心。几年来，依拖 自己独特的工程管理系统和全程服务系统，以高效、多元、人性的服务，为社会奉献一个又一个的精品装饰工程。,装修/设计,B,,,中山北路2911号中关村科技大厦1805室(近三四号线曹杨路站),13761362272,,9:00_20:00
911,拓锦装潢,http://www.tuojinsh.com/,上海拓锦装饰设计工程有限公司是一家专业从事室内外装潢的品牌优秀企业，公司拥有良好的企业文化，先进的设计理念，服务理念，质量理念，公司设计力量雄 厚，设计师均为中级以上职称的国家注册室内设计师，拥有专业施工人员，员工素质高，装修性价比高，做工精细，深受客户赞誉。 公司人员随叫随到，为您免费量房，根据房型做出最佳设计，为您打造出舒适，温馨，永不过时的完美家居。免费将方案、预算送到家，让您足不出户，运筹帷幄。,装修/设计,B,,,铁岭路32号同叶大厦808-809室(近锦西路),021-65130455,,8：30-18：00
212,完美设计,http://www.51wanmei.com/,"国家装饰设计乙级资质_x000D_
国家装饰施工二级资质_x000D_
由国际设计精英共同组成的设计团队_x000D_
60多人的创意创新精英",装修-办公室,B,,1998,延安西路895号20楼D2室(古北路虹桥路),021-62250668,,
538,完美装饰,http://www.bjwmzs.com/,完美装饰设计成立于2006年，历经数年积淀，现已扩展成为以建筑、装饰、设计为主营的多元化公司。完美装饰是一家以家居装修、商场装修、酒店设计、及建筑设计规划，景观园林设计为一体的设计公司，在设计领域逐渐形成规模化、专业化、品牌化的绝对优势。完美装饰公司是近年来快速发展起来具有一定规模的设计公司，公司从事家居、别墅、商铺、酒店、宾馆、土建设计、景观园林规划、施工等一条龙服务。  ,装修/设计,B,,2006,杨思路860弄77号102室(近地铁8号线杨思站),021-60892981,,8.00—20.00
655,显高设计,http://www.hinkoo.cn/,"上海显高装饰设计工程有限公司，是一家专门从事室内设计、施工的专业化公司。十几年来，显高公司凭借一批高水准的设计师团队和具有多年实战经验的施工技师，以良好的服务，独特的经营理念，在上海乃全国的装饰装修行业中取得了很高的知名度和美誉度。
 ",装修/设计,B,,,怒江北路598号红星世贸大厦26楼,021-32568062,,
622,显尚设计,http://www.jinxindc.com/,"  上海显尚装饰工程设计有限公司是一家集空间艺术设计、装潢、家居集成为一体的设计装饰企业，致力于服务成功人士的居家设计装修。凭借一批高水准的专业设计团队和具有多年实战经验的施工技师，以良好的服务，独特的经营理念，在上海的装饰装修行业中取得了很高的知名度和美誉度

上海显尚装饰工程设计有限公司成立于1994年，拥有国家设计乙级、施工二级资质，有工装事业部和家装事业部两大主体构成，工装事业部主要承接星级酒店，高级会所、 OFFICE等商业空间的设计、装饰及配套工程，家装事业部主要承接中高档家居空间的设计装饰、家居集成以及完整装修。每一份都是精品之作，全程演绎私人空间的高品位人文概念，对复式、别墅、商业空间的设计制作更树立经典之帜。",装修/设计,B,,1994,怒江北路598号红星世贸大厦2203室,,,
95,香港欧雅国际设计,http://www.ouyazh.com/,成立于1998年，隶属于上海三牛装饰设计有限公司，专业从事别墅设计、别墅装饰、别墅装潢、别墅装修，高档样板房、大型商业空间、公共场所等空间的设计与施工，集设计、装饰、景观、园林、软装配饰、空间智能为一体的设计装饰企业。,装修/设计,B,,1998,肇嘉浜路825号尚秀商务楼3楼(近宛平南路),021-64696685,,
85,香港尊筑国际设计,http://www.joh.hk/index.html,上海尊筑建筑设计装饰工程有限公司专业从事别墅、高档样板房、大型商业空间、公共场所等大空间的设计与施工，集设计、装饰、景观、园林、软装配饰、空间智能等相关配套产业为一体。具备中国工程设计与施工壹级资质的尊筑设计，上海尊筑建筑设计装饰工程有限公司与江苏尊筑建筑工程有限公司共同打造由长三角辐射全国的战略格局。,装修/设计,B,,1996,天钥桥路909号D1国际创意园区主楼一楼,021-51097722,,
97,祥庭设计,http://www.xiang-t.com/, 祥庭装饰，全名祥庭（上海）装饰设计工程有限公司，坐落于繁华的上海徐汇区，是由15年装饰发展历程的浙江丽园集团与温哥华NH设计事务所合作成立的高端设计品牌。于1997年成立的浙江丽园装饰，在全国设立近二十家直属分公司，拥有建筑装饰施工二级资质，先后被评为全国住宅装饰装修百强企业、全国住宅装饰质量服务五星企业、全国住宅装饰装修示范工程、全国住宅装饰行业知名品牌等众多荣誉。 ,装修/设计,B,,1997,宜山路889号齐来大厦203室,021-60298280,,
98,欣进装饰,http://sh-xinjin.ebdoor.com/," 上海欣进装饰公司创建于2003年，公司具有20年的行业施工经验（拥有20支施工队伍）。

   欣进旗下多伦多创意设计-TORONTO Interior Design （T.I.D）是一支拥有白金级设计大师的精英团队，真正做到了高端设计与平民价施工的完美结合，至今为止网络投诉率为零，好评不断，力求成为真正的网络装修冠军。
",装修/设计,B,,2003,宜山路515号环线大厦2号楼26楼(近博库书城),021-34141571&nbsp;64040638,,
586,新庭装潢,http://www.xintingzh.com/,"上海新庭装潢设计有限公司成立于2002年，荣获国际建筑装饰设计委员会T-08会员单位.荣获上海市装饰装修行业协会T-120会员单位.公司荣获上海市装饰装修专业资质证书,编号JZ-3102261264.在07,08年行风测评中,市民抽样调查中荣获星级达标服务企业.是沪上装饰界人气很强的装饰企业之一.公司本着“诚信至上、质量第一、追求卓越、打造品牌”的宗旨，一切站在客户的角度去考虑问题，公司致力于中高档住宅、及商务空间的设计主要从事居室家庭、商业店铺、门面、商务楼（并注重二手旧房的改建装饰）、室内外设计、施工业务。",装修/设计,B,,2002,浦东大道2635号,,,
